[
  {
    "attribution": {
      "license_name": null,
      "required": false,
      "text": null,
      "url": null
    },
    "images": [
      {
        "attribution": null,
        "cache_policy": null,
        "expires_at": null,
        "headers": {},
        "image_id": null,
        "kind": "cover",
        "mirror_policy": null,
        "provider": "openlibrary",
        "thumbnail_url": null,
        "url": "https://covers.openlibrary.org/b/id/12345-L.jpg"
      }
    ],
    "kind": "book",
    "normalized": {
      "characters": [],
      "cover_image_url": "https://covers.openlibrary.org/b/id/12345-L.jpg",
      "creators": [
        {
          "external_ids": {},
          "name": "J.R.R. Tolkien",
          "role": "author"
        }
      ],
      "external_ids": {},
      "external_links": [],
      "genres": [
        "Fantasy",
        "Adventure"
      ],
      "isbn": "9780261102354",
      "kind": "book",
      "page_count": 423,
      "platforms": [],
      "provider_ids": {
        "openlibrary": "OL27479W",
        "openlibrary_edition": "OL82563M"
      },
      "publisher": "George Allen & Unwin",
      "relations": [],
      "seasons": [],
      "story_arcs": [],
      "subtitle": "Being the First Part of The Lord of the Rings",
      "synopsis": "The first volume of the epic high-fantasy novel.",
      "title": "The Fellowship of the Ring",
      "tracks": [],
      "trailer_urls": [],
      "variant_covers": [],
      "volume_provider_ids": {}
    },
    "provenance": {
      "fetched_at": "2026-08-17T12:00:00Z",
      "provider_version": "1.0.0",
      "raw_payload_hash": "bfdb9cb0981ea61d5d13ba4a02a3e37027833c88fbcb195e9eaa52212756b51a",
      "source_url": "https://openlibrary.org/works/OL27479W"
    },
    "provider": "openlibrary",
    "provider_item_id": "OL27479W",
    "schema_version": "v1"
  },
  {
    "attribution": {
      "license_name": null,
      "required": false,
      "text": null,
      "url": null
    },
    "images": [
      {
        "attribution": null,
        "cache_policy": null,
        "expires_at": null,
        "headers": {},
        "image_id": null,
        "kind": "cover",
        "mirror_policy": null,
        "provider": "anilist",
        "thumbnail_url": null,
        "url": "https://s4.anilist.co/file/anilistcdn/media/manga/cover/large/bx30002-777.jpg"
      }
    ],
    "kind": "manga",
    "normalized": {
      "characters": [],
      "cover_image_url": "https://s4.anilist.co/file/anilistcdn/media/manga/cover/large/bx30002-777.jpg",
      "creators": [
        {
          "external_ids": {},
          "name": "Kentarou Miura",
          "role": "Story & Art"
        }
      ],
      "external_ids": {},
      "external_links": [],
      "genres": [
        "Action",
        "Adventure",
        "Dark Fantasy"
      ],
      "kind": "manga",
      "platforms": [],
      "provider_ids": {
        "anilist": "30002",
        "mal": "2"
      },
      "publisher": "Hakusensha",
      "relations": [],
      "seasons": [],
      "story_arcs": [],
      "synopsis": "Guts, a former mercenary known as the Black Swordsman, seeks revenge.",
      "title": "Berserk",
      "tracks": [],
      "trailer_urls": [],
      "variant_covers": [],
      "volume_provider_ids": {}
    },
    "provenance": {
      "fetched_at": "2026-08-17T12:00:00Z",
      "provider_version": "1.0.0",
      "raw_payload_hash": "24fde0555a57b89878dfe7c4e248e2aba157acf8a5c0ba6d4ecfa4145d1f4a4a",
      "source_url": "https://anilist.co/manga/30002"
    },
    "provider": "anilist",
    "provider_item_id": "30002",
    "schema_version": "v1"
  },
  {
    "attribution": {
      "license_name": null,
      "required": false,
      "text": null,
      "url": null
    },
    "images": [
      {
        "attribution": null,
        "cache_policy": null,
        "expires_at": null,
        "headers": {},
        "image_id": null,
        "kind": "cover",
        "mirror_policy": null,
        "provider": "musicbrainz",
        "thumbnail_url": null,
        "url": "https://coverartarchive.org/release/a1b2c3d4/front.jpg"
      }
    ],
    "kind": "music",
    "normalized": {
      "characters": [],
      "cover_image_url": "https://coverartarchive.org/release/a1b2c3d4/front.jpg",
      "creators": [
        {
          "external_ids": {},
          "name": "Pink Floyd",
          "role": "Artist"
        }
      ],
      "external_ids": {},
      "external_links": [],
      "genres": [
        "Progressive Rock",
        "Psychedelic Rock"
      ],
      "kind": "music",
      "platforms": [],
      "provider_ids": {
        "musicbrainz": "a1b2c3d4-e5f6-7a8b-9c0d-1e2f3a4b5c6d"
      },
      "publisher": "Harvest",
      "relations": [],
      "seasons": [],
      "story_arcs": [],
      "title": "The Dark Side of the Moon",
      "track_count": 3,
      "tracks": [
        {
          "duration_seconds": 67,
          "indent_level": 0,
          "is_header": false,
          "position": 1,
          "title": "Speak to Me"
        },
        {
          "duration_seconds": 169,
          "indent_level": 0,
          "is_header": false,
          "position": 2,
          "title": "Breathe (In the Air)"
        },
        {
          "duration_seconds": 425,
          "indent_level": 0,
          "is_header": false,
          "position": 3,
          "title": "Time"
        }
      ],
      "trailer_urls": [],
      "variant_covers": [],
      "volume_provider_ids": {}
    },
    "provenance": {
      "fetched_at": "2026-08-17T12:00:00Z",
      "provider_version": "1.0.0",
      "raw_payload_hash": "fffb76596af1a1de539ea6f5d50a1dfb7f180d890305c5ba0ee7b11d1846957a",
      "source_url": "https://musicbrainz.org/release/a1b2c3d4-e5f6-7a8b-9c0d-1e2f3a4b5c6d"
    },
    "provider": "musicbrainz",
    "provider_item_id": "a1b2c3d4-e5f6-7a8b-9c0d-1e2f3a4b5c6d",
    "schema_version": "v1"
  },
  {
    "attribution": {
      "license_name": null,
      "required": false,
      "text": null,
      "url": null
    },
    "images": [
      {
        "attribution": null,
        "cache_policy": null,
        "expires_at": null,
        "headers": {},
        "image_id": null,
        "kind": "cover",
        "mirror_policy": null,
        "provider": "mangadex",
        "thumbnail_url": null,
        "url": "https://uploads.mangadex.org/covers/d7037b2a-874a-4360-8a7b-07f2001542a9/cover.jpg"
      }
    ],
    "kind": "manga",
    "normalized": {
      "characters": [],
      "cover_image_url": "https://uploads.mangadex.org/covers/d7037b2a-874a-4360-8a7b-07f2001542a9/cover.jpg",
      "creators": [
        {
          "external_ids": {},
          "name": "Tatsuki Fujimoto",
          "role": "Author/Artist"
        }
      ],
      "external_ids": {},
      "external_links": [],
      "genres": [
        "Action",
        "Supernatural",
        "Comedy"
      ],
      "kind": "manga",
      "platforms": [],
      "provider_ids": {
        "mangadex": "d7037b2a-874a-4360-8a7b-07f2001542a9"
      },
      "publisher": "Shueisha",
      "relations": [],
      "seasons": [],
      "story_arcs": [],
      "synopsis": "Denji is a teenage boy living with a Chainsaw Devil named Pochita.",
      "title": "Chainsaw Man",
      "tracks": [],
      "trailer_urls": [],
      "variant_covers": [],
      "volume_provider_ids": {}
    },
    "provenance": {
      "fetched_at": "2026-08-17T12:00:00Z",
      "provider_version": "1.0.0",
      "raw_payload_hash": "b956dd770e65d56fc3ebe8bff1d2417ff8cbb8d5e42854be5e2fff9545f56cc5",
      "source_url": "https://mangadex.org/title/d7037b2a-874a-4360-8a7b-07f2001542a9"
    },
    "provider": "mangadex",
    "provider_item_id": "d7037b2a-874a-4360-8a7b-07f2001542a9",
    "schema_version": "v1"
  },
  {
    "attribution": {
      "license_name": null,
      "required": false,
      "text": null,
      "url": null
    },
    "images": [
      {
        "attribution": null,
        "cache_policy": null,
        "expires_at": null,
        "headers": {},
        "image_id": null,
        "kind": "cover",
        "mirror_policy": null,
        "provider": "gcd",
        "thumbnail_url": null,
        "url": "https://www.comics.org/media/img/covers/12345.jpg"
      }
    ],
    "kind": "comic",
    "normalized": {
      "characters": [
        {
          "external_ids": {},
          "name": "Spider-Man"
        },
        {
          "external_ids": {},
          "name": "Venom"
        }
      ],
      "cover_image_url": "https://www.comics.org/media/img/covers/12345.jpg",
      "creators": [
        {
          "external_ids": {},
          "name": "David Michelinie",
          "role": "writer"
        },
        {
          "external_ids": {},
          "name": "Todd McFarlane",
          "role": "penciller"
        }
      ],
      "external_ids": {},
      "external_links": [],
      "genres": [],
      "item_number": "300",
      "kind": "comic",
      "platforms": [],
      "provider_ids": {
        "gcd": "12345"
      },
      "publisher": "Marvel Comics",
      "relations": [],
      "seasons": [],
      "series_title": "The Amazing Spider-Man",
      "story_arcs": [],
      "synopsis": "Venom makes his first full appearance.",
      "title": "Amazing Spider-Man #300",
      "tracks": [],
      "trailer_urls": [],
      "variant_covers": [],
      "volume_provider_ids": {}
    },
    "provenance": {
      "fetched_at": "2026-08-17T12:00:00Z",
      "provider_version": "1.0.0",
      "raw_payload_hash": "7e78088496c67164658d11799085cfd76c0a52a0e6ad816301efb5224de28be9",
      "source_url": "https://www.comics.org/issue/12345/"
    },
    "provider": "gcd",
    "provider_item_id": "12345",
    "schema_version": "v1"
  },
  {
    "attribution": {
      "license_name": null,
      "required": false,
      "text": null,
      "url": null
    },
    "images": [
      {
        "attribution": null,
        "cache_policy": null,
        "expires_at": null,